sentence_id,sentence,entities
151,"Her face was working and twitching with passion , but his looked up at the sky , still quiet , neither angry nor afraid , but a little sad .","[{""text"": ""Her"", ""canonical"": ""Jadis"", ""label"": ""ACTIVE_PERFORMER""}, {""text"": ""his"", ""canonical"": ""Aslan"", ""label"": ""ACTIVE_PERFORMER""}]"
152,"Then , just before she gave the blow , she stooped down and said in a quivering voice ,","[{""text"": ""she"", ""canonical"": ""Jadis"", ""label"": ""ACTIVE_SPEAKER""}]"
153,""" And now , who has won ?","[]"
154,"Fool , did you think that by all this you would save the human traitor ?","[{""text"": ""Fool"", ""canonical"": ""Aslan"", ""label"": ""ADDRESSED""}, {""text"": ""human traitor"", ""canonical"": ""Edmund Pevensie"", ""label"": ""MENTIONED_ONLY""}]"
155,"Now I will kill you instead of him as our pact was and so the Deep Magic will be appeased .","[{""text"": ""you"", ""canonical"": ""Aslan"", ""label"": ""ADDRESSED""}, {""text"": ""him"", ""canonical"": ""Edmund Pevensie"", ""label"": ""MENTIONED_ONLY""}]"
156,"But when you are dead what will prevent me from killing him as well ?","[{""text"": ""you"", ""canonical"": ""Aslan"", ""label"": ""ADDRESSED""}, {""text"": ""him"", ""canonical"": ""Edmund Pevensie"", ""label"": ""MENTIONED_ONLY""}]"
157,"And who will take him out of my hand _then_ ?","[{""text"": ""him"", ""canonical"": ""Edmund Pevensie"", ""label"": ""MENTIONED_ONLY""}]"
158,"Understand that you have given me Narnia forever , you have lost your own life and you have not saved his .","[{""text"": ""you"", ""canonical"": ""Aslan"", ""label"": ""ADDRESSED""}]"
159,"In that knowledge , despair and die . ""","[]"
160,"The children did not see the actual moment of the killing .","[{""text"": ""children"", ""canonical"": ""Lucy Pevensie"", ""label"": ""ACTIVE_PERFORMER""}, {""text"": ""children"", ""canonical"": ""Susan Pevensie"", ""label"": ""ACTIVE_PERFORMER""}]"
161,"They could n't bear to look and had covered their eyes .","[{""text"": ""They"", ""canonical"": ""Lucy Pevensie"", ""label"": ""ACTIVE_PERFORMER""}, {""text"": ""They"", ""canonical"": ""Susan Pevensie"", ""label"": ""ACTIVE_PERFORMER""}]"